{
  "$schema": "https://json-schema.org/draft/2020-12/schema",
  "$id": "https://schemas.standardflow.dev/standardflow-lock.v1.schema.json",
  "title": "StandardFlow deterministic pack lock",
  "type": "object",
  "additionalProperties": false,
  "required": [
    "schema_version",
    "algorithm",
    "pack_id",
    "pack_version",
    "canonical_pack_sha256",
    "files",
    "tree_sha256"
  ],
  "properties": {
    "schema_version": {"const": "dev.standardflow.lock.v1"},
    "algorithm": {"const": "sha256"},
    "pack_id": {
      "type": "string",
      "pattern": "^[a-z0-9][a-z0-9._-]*(/[a-z0-9][a-z0-9._-]*)+$"
    },
    "pack_version": {"type": "string", "minLength": 1},
    "canonical_pack_sha256": {"type": "string", "pattern": "^[a-f0-9]{64}$"},
    "files": {
      "type": "array",
      "items": {
        "type": "object",
        "additionalProperties": false,
        "required": ["path", "bytes", "sha256"],
        "properties": {
          "path": {
            "type": "string",
            "minLength": 1,
            "not": {"pattern": "(^/|(^|/)\\.\\.?(/|$)|//|\\\\)"}
          },
          "bytes": {"type": "integer", "minimum": 0},
          "sha256": {"type": "string", "pattern": "^[a-f0-9]{64}$"}
        }
      }
    },
    "tree_sha256": {"type": "string", "pattern": "^[a-f0-9]{64}$"}
  }
}
