{"algorithm":"sha256","canonical_pack_sha256":"b9dbf62d83d099728963eab4c88de4939168d89a65e166d52652a0b2c901f28e","files":[{"bytes":514,"path":"README.md","sha256":"892f32146905982d64fd80ec5a2b03d9038d0ef1725cc86c032bdaf1081d1ba6"},{"bytes":2361,"path":"citations.csl.json","sha256":"dcfacc0ca4e46f890cf810d7deed299eab2d6340ec3ee5368ff0bc5ac8c678b6"},{"bytes":18694,"path":"pack.json","sha256":"2c4ca02e5c8fb65f046b6eb1cf131769288f07d1f92f16a50f721a03be3c429b"},{"bytes":895,"path":"sources/manifest.json","sha256":"5e8748190c232e6845abec320e7e934939f5a2858ae29074d8a56b889158f27b"}],"pack_id":"org.prisma/prisma/2020","pack_version":"2020","schema_version":"dev.standardflow.lock.v1","tree_sha256":"1503c47ddd2f56d17c0ff5583313b62457fea139df289eb2432b760c32a782d6"}
